RefSeqRNA Accession,Entrez ID,Gene Name,Gene Summary,NCBI Link
NM_000832,2902,glutamate ionotropic receptor NMDA type subunit 1,"The protein encoded by this gene is a critical subunit of N-methyl-D-aspartate receptors, members of the glutamate receptor channel superfamily which are heteromeric protein complexes with multiple subunits arranged to form a ligand-gated ion channel. These subunits play a key role in the plasticity of synapses, which is believed to underlie memory and learning. Cell-specific factors are thought to control expression of different isoforms, possibly contributing to the functional diversity of the subunits. Alternatively spliced transcript variants have been described.","<a href=""https://www.ncbi.nlm.nih.gov/gene/2902"">https://www.ncbi.nlm.nih.gov/gene/2902</a>"
NM_000835,2905,glutamate ionotropic receptor NMDA type subunit 2C,"This gene encodes a subunit of the N-methyl-D-aspartate (NMDA) receptor, which is a subtype of ionotropic glutamate receptor. NMDA receptors are found in the central nervous system, are permeable to cations and have an important role in physiological processes such as learning, memory, and synaptic development. The receptor is a tetramer of different subunits (typically heterodimer of subunit 1 with one or more of subunits 2A-D), forming a channel that is permeable to calcium, potassium, and sodium, and whose properties are determined by subunit composition. Alterations in the subunit composition of the receptor are associated with pathophysiological conditions such as Parkinson's disease, Alzheimer's disease, depression, and schizophrenia. Alternative splicing results in multiple transcript variants.","<a href=""https://www.ncbi.nlm.nih.gov/gene/2905"">https://www.ncbi.nlm.nih.gov/gene/2905</a>"
NM_000837,2907,glutamate ionotropic receptor NMDA type subunit associated protein 1,,"<a href=""https://www.ncbi.nlm.nih.gov/gene/2907"">https://www.ncbi.nlm.nih.gov/gene/2907</a>"
NM_000842,2915,glutamate metabotropic receptor 5,"This gene encodes a member of the G-protein coupled receptor 3 protein family. The encoded protein is a metabatropic glutamate receptor, whose signaling activates a phosphatidylinositol-calcium second messenger system. This protein may be involved in the regulation of neural network activity and synaptic plasticity. Glutamatergic neurotransmission is involved in most aspects of normal brain function and can be perturbed in many neuropathologic conditions. A pseudogene of this gene has been defined on chromosome 11. Alternative splicing results in multiple transcript variants.","<a href=""https://www.ncbi.nlm.nih.gov/gene/2915"">https://www.ncbi.nlm.nih.gov/gene/2915</a>"
NM_000852,2950,glutathione S-transferase pi 1,"Glutathione S-transferases (GSTs) are a family of enzymes that play an important role in detoxification by catalyzing the conjugation of many hydrophobic and electrophilic compounds with reduced glutathione. Based on their biochemical, immunologic, and structural properties, the soluble GSTs are categorized into 4 main classes: alpha, mu, pi, and theta. This GST family member is a polymorphic gene encoding active, functionally different GSTP1 variant proteins that are thought to function in xenobiotic metabolism and play a role in susceptibility to cancer, and other diseases.","<a href=""https://www.ncbi.nlm.nih.gov/gene/2950"">https://www.ncbi.nlm.nih.gov/gene/2950</a>"
NM_004712,9146,hepatocyte growth factor-regulated tyrosine kinase substrate,"The protein encoded by this gene regulates endosomal sorting and plays a critical role in the recycling and degradation of membrane receptors. The encoded protein sorts monoubiquitinated membrane proteins into the multivesicular body, targeting these proteins for lysosome-dependent degradation.","<a href=""https://www.ncbi.nlm.nih.gov/gene/9146"">https://www.ncbi.nlm.nih.gov/gene/9146</a>"
NM_001243084,3091,hypoxia inducible factor 1 alpha subunit,"This gene encodes the alpha subunit of transcription factor hypoxia-inducible factor-1 (HIF-1), which is a heterodimer composed of an alpha and a beta subunit. HIF-1 functions as a master regulator of cellular and systemic homeostatic response to hypoxia by activating transcription of many genes, including those involved in energy metabolism, angiogenesis, apoptosis, and other genes whose protein products increase oxygen delivery or facilitate metabolic adaptation to hypoxia. HIF-1 thus plays an essential role in embryonic vascularization, tumor angiogenesis and pathophysiology of ischemic disease. Alternatively spliced transcript variants encoding different isoforms have been identified for this gene.","<a href=""https://www.ncbi.nlm.nih.gov/gene/3091"">https://www.ncbi.nlm.nih.gov/gene/3091</a>"
NM_000859,3156,3-hydroxy-3-methylglutaryl-CoA reductase,"HMG-CoA reductase is the rate-limiting enzyme for cholesterol synthesis and is regulated via a negative feedback mechanism mediated by sterols and non-sterol metabolites derived from mevalonate, the product of the reaction catalyzed by reductase. Normally in mammalian cells this enzyme is suppressed by cholesterol derived from the internalization and degradation of low density lipoprotein (LDL) via the LDL receptor. Competitive inhibitors of the reductase induce the expression of LDL receptors in the liver, which in turn increases the catabolism of plasma LDL and lowers the plasma concentration of cholesterol, an important determinant of atherosclerosis. Alternatively spliced transcript variants encoding different isoforms have been found for this gene.","<a href=""https://www.ncbi.nlm.nih.gov/gene/3156"">https://www.ncbi.nlm.nih.gov/gene/3156</a>"
NM_002133,3162,heme oxygenase 1,"Heme oxygenase, an essential enzyme in heme catabolism, cleaves heme to form biliverdin, which is subsequently converted to bilirubin by biliverdin reductase, and carbon monoxide, a putative neurotransmitter. Heme oxygenase activity is induced by its substrate heme and by various nonheme substances. Heme oxygenase occurs as 2 isozymes, an inducible heme oxygenase-1 and a constitutive heme oxygenase-2. HMOX1 and HMOX2 belong to the heme oxygenase family.","<a href=""https://www.ncbi.nlm.nih.gov/gene/3162"">https://www.ncbi.nlm.nih.gov/gene/3162</a>"
NM_004839,9455,homer scaffolding protein 2,This gene encodes a member of the homer family of dendritic proteins. Members of this family regulate group 1 metabotrophic glutamate receptor function. The encoded protein is a postsynaptic density scaffolding protein. Alternative splicing results in multiple transcript variants. Two related pseudogenes have been identified on chromosome 14.,"<a href=""https://www.ncbi.nlm.nih.gov/gene/9455"">https://www.ncbi.nlm.nih.gov/gene/9455</a>"
NM_005345,3303,heat shock protein family A (Hsp70) member 1A,"This intronless gene encodes a 70kDa heat shock protein which is a member of the heat shock protein 70 family. In conjuction with other heat shock proteins, this protein stabilizes existing proteins against aggregation and mediates the folding of newly translated proteins in the cytosol and in organelles. It is also involved in the ubiquitin-proteasome pathway through interaction with the AU-rich element RNA-binding protein 1. The gene is located in the major histocompatibility complex class III region, in a cluster with two closely related genes which encode similar proteins.","<a href=""https://www.ncbi.nlm.nih.gov/gene/3303"">https://www.ncbi.nlm.nih.gov/gene/3303</a>"
NM_005346,3304,heat shock protein family A (Hsp70) member 1B,"This intronless gene encodes a 70kDa heat shock protein which is a member of the heat shock protein 70 family. In conjuction with other heat shock proteins, this protein stabilizes existing proteins against aggregation and mediates the folding of newly translated proteins in the cytosol and in organelles. It is also involved in the ubiquitin-proteasome pathway through interaction with the AU-rich element RNA-binding protein 1. The gene is located in the major histocompatibility complex class III region, in a cluster with two closely related genes which encode similar proteins.","<a href=""https://www.ncbi.nlm.nih.gov/gene/3304"">https://www.ncbi.nlm.nih.gov/gene/3304</a>"
NM_005347,3309,heat shock protein family A (Hsp70) member 5,"The protein encoded by this gene is a member of the heat shock protein 70 (HSP70) family. It is localized in the lumen of the endoplasmic reticulum (ER), and is involved in the folding and assembly of proteins in the ER. As this protein interacts with many ER proteins, it may play a key role in monitoring protein transport through the cell.","<a href=""https://www.ncbi.nlm.nih.gov/gene/3309"">https://www.ncbi.nlm.nih.gov/gene/3309</a>"
NM_006597,3312,heat shock protein family A (Hsp70) member 8,"This gene encodes a member of the heat shock protein 70 family, which contains both heat-inducible and constitutively expressed members. This protein belongs to the latter group, which are also referred to as heat-shock cognate proteins. It functions as a chaperone, and binds to nascent polypeptides to facilitate correct folding. It also functions as an ATPase in the disassembly of clathrin-coated vesicles during transport of membrane components through the cell. Alternatively spliced transcript variants encoding different isoforms have been found for this gene.","<a href=""https://www.ncbi.nlm.nih.gov/gene/3312"">https://www.ncbi.nlm.nih.gov/gene/3312</a>"
NM_001540,3315,heat shock protein family B (small) member 1,The protein encoded by this gene is induced by environmental stress and developmental changes. The encoded protein is involved in stress resistance and actin organization and translocates from the cytoplasm to the nucleus upon stress induction. Defects in this gene are a cause of Charcot-Marie-Tooth disease type 2F (CMT2F) and distal hereditary motor neuropathy (dHMN).,"<a href=""https://www.ncbi.nlm.nih.gov/gene/3315"">https://www.ncbi.nlm.nih.gov/gene/3315</a>"
NM_001541,3316,heat shock protein family B (small) member 2,"The protein encoded by this gene belongs to the superfamily of small heat-shock proteins containing a conservative alpha-crystallin domain at the C-terminal part of the molecule. The protein is expressed preferentially in the heart and skeletal muscle. This protein regulates Myotonic Dystrophy Protein Kinase, which plays an important role in maintenance of muscle structure and function.","<a href=""https://www.ncbi.nlm.nih.gov/gene/3316"">https://www.ncbi.nlm.nih.gov/gene/3316</a>"
NM_000863,3351,5-hydroxytryptamine receptor 1B,"The protein encoded by this intronless gene is a G-protein coupled receptor for serotonin (5-hydroxytryptamine). Ligand binding activates second messengers that inhibit the activity of adenylate cyclase and manage the release of serotonin, dopamine, and acetylcholine in the brain. The encoded protein may be involved in several neuropsychiatric disorders and therefore is often a target of antidepressant and other psychotherapeutic drugs.","<a href=""https://www.ncbi.nlm.nih.gov/gene/3351"">https://www.ncbi.nlm.nih.gov/gene/3351</a>"
NM_000621,3356,5-hydroxytryptamine receptor 2A,"This gene encodes one of the receptors for serotonin, a neurotransmitter with many roles. Mutations in this gene are associated with susceptibility to schizophrenia and obsessive-compulsive disorder, and are also associated with response to the antidepressant citalopram in patients with major depressive disorder (MDD). MDD patients who also have a mutation in intron 2 of this gene show a significantly reduced response to citalopram as this antidepressant downregulates expression of this gene. Multiple transcript variants encoding different isoforms have been found for this gene.","<a href=""https://www.ncbi.nlm.nih.gov/gene/3356"">https://www.ncbi.nlm.nih.gov/gene/3356</a>"
NM_002775,5654,HtrA serine peptidase 1,This gene encodes a member of the trypsin family of serine proteases. This protein is a secreted enzyme that is proposed to regulate the availability of insulin-like growth factors (IGFs) by cleaving IGF-binding proteins. It has also been suggested to be a regulator of cell growth. Variations in the promoter region of this gene are the cause of susceptibility to age-related macular degeneration type 7.,"<a href=""https://www.ncbi.nlm.nih.gov/gene/5654"">https://www.ncbi.nlm.nih.gov/gene/5654</a>"
NM_001318491,8100,intraflagellar transport 88,This gene encodes a member of the tetratrico peptide repeat (TPR) family. Mutations of a similar gene in mouse can cause polycystic kidney disease. Two transcript variants encoding distinct isoforms have been identified for this gene.,"<a href=""https://www.ncbi.nlm.nih.gov/gene/8100"">https://www.ncbi.nlm.nih.gov/gene/8100</a>"
NM_000875,3480,insulin like growth factor 1 receptor,This receptor binds insulin-like growth factor with a high affinity. It has tyrosine kinase activity. The insulin-like growth factor I receptor plays a critical role in transformation events. Cleavage of the precursor generates alpha and beta subunits. It is highly overexpressed in most malignant tissues where it functions as an anti-apoptotic agent by enhancing cell survival. Alternatively spliced transcript variants encoding distinct isoforms have been found for this gene.,"<a href=""https://www.ncbi.nlm.nih.gov/gene/3480"">https://www.ncbi.nlm.nih.gov/gene/3480</a>"
NM_000612,3481,insulin like growth factor 2,"This gene encodes a member of the insulin family of polypeptide growth factors, which are involved in development and growth. It is an imprinted gene, expressed only from the paternal allele, and epigenetic changes at this locus are associated with Wilms tumour, Beckwith-Wiedemann syndrome, rhabdomyosarcoma, and Silver-Russell syndrome. A read-through INS-IGF2 gene exists, whose 5' region overlaps the INS gene and the 3' region overlaps this gene. Alternatively spliced transcript variants encoding different isoforms have been found for this gene.","<a href=""https://www.ncbi.nlm.nih.gov/gene/3481"">https://www.ncbi.nlm.nih.gov/gene/3481</a>"
NM_000597,3485,insulin like growth factor binding protein 2,"The protein encoded by this gene is one of six similar proteins that bind insulin-like growth factors I and II (IGF-I and IGF-II). The encoded protein can be secreted into the bloodstream, where it binds IGF-I and IGF-II with high affinity, or it can remain intracellular, interacting with many different ligands. High expression levels of this protein promote the growth of several types of tumors and may be predictive of the chances of recovery of the patient. Several transcript variants, one encoding a secreted isoform and the others encoding nonsecreted isoforms, have been found for this gene.","<a href=""https://www.ncbi.nlm.nih.gov/gene/3485"">https://www.ncbi.nlm.nih.gov/gene/3485</a>"
NM_001558,3587,interleukin 10 receptor subunit alpha,"The protein encoded by this gene is a receptor for interleukin 10. This protein is structurally related to interferon receptors. It has been shown to mediate the immunosuppressive signal of interleukin 10, and thus inhibits the synthesis of proinflammatory cytokines. This receptor is reported to promote survival of progenitor myeloid cells through the insulin receptor substrate-2/PI 3-kinase/AKT pathway. Activation of this receptor leads to tyrosine phosphorylation of JAK1 and TYK2 kinases. Two transcript variants, one protein-coding and the other not protein-coding, have been found for this gene.","<a href=""https://www.ncbi.nlm.nih.gov/gene/3587"">https://www.ncbi.nlm.nih.gov/gene/3587</a>"
NM_000564,3568,interleukin 5 receptor subunit alpha,"The protein encoded by this gene is an interleukin 5 specific subunit of a heterodimeric cytokine receptor. The receptor is comprised of a ligand specific alpha subunit and a signal transducing beta subunit shared by the receptors for interleukin 3 (IL3), colony stimulating factor 2 (CSF2/GM-CSF), and interleukin 5 (IL5). The binding of this protein to IL5 depends on the beta subunit. The beta subunit is activated by the ligand binding, and is required for the biological activities of IL5. This protein has been found to interact with syndecan binding protein (syntenin), which is required for IL5 mediated activation of the transcription factor SOX4. Several alternatively spliced transcript variants encoding four distinct isoforms have been reported.","<a href=""https://www.ncbi.nlm.nih.gov/gene/3568"">https://www.ncbi.nlm.nih.gov/gene/3568</a>"
NM_006084,10379,interferon regulatory factor 9,,"<a href=""https://www.ncbi.nlm.nih.gov/gene/10379"">https://www.ncbi.nlm.nih.gov/gene/10379</a>"
NM_001171581,9452,integral membrane protein 2A,This gene encodes a type II membrane protein that belongs to the ITM2 family. Studies in mouse suggest that it may be involved in osteo- and chondrogenic differentiation. Alternatively spliced transcript variants encoding different isoforms have been found for this gene.,"<a href=""https://www.ncbi.nlm.nih.gov/gene/9452"">https://www.ncbi.nlm.nih.gov/gene/9452</a>"
NM_002221,3707,inositol-trisphosphate 3-kinase B,"The protein encoded by this protein regulates inositol phosphate metabolism by phosphorylation of second messenger inositol 1,4,5-trisphosphate to Ins(1,3,4,5)P4. The activity of this encoded protein is responsible for regulating the levels of a large number of inositol polyphosphates that are important in cellular signaling. Both calcium/calmodulin and protein phosphorylation mechanisms control its activity.","<a href=""https://www.ncbi.nlm.nih.gov/gene/3707"">https://www.ncbi.nlm.nih.gov/gene/3707</a>"
NM_002228,3725,"Jun proto-oncogene, AP-1 transcription factor subunit","This gene is the putative transforming gene of avian sarcoma virus 17. It encodes a protein which is highly similar to the viral protein, and which interacts directly with specific target DNA sequences to regulate gene expression. This gene is intronless and is mapped to 1p32-p31, a chromosomal region involved in both translocations and deletions in human malignancies.","<a href=""https://www.ncbi.nlm.nih.gov/gene/3725"">https://www.ncbi.nlm.nih.gov/gene/3725</a>"
NM_002229,3726,"JunB proto-oncogene, AP-1 transcription factor subunit",,"<a href=""https://www.ncbi.nlm.nih.gov/gene/3726"">https://www.ncbi.nlm.nih.gov/gene/3726</a>"
NM_001024660,8997,kalirin RhoGEF kinase,"Huntington's disease (HD), a neurodegenerative disorder characterized by loss of striatal neurons, is caused by an expansion of a polyglutamine tract in the HD protein huntingtin. This gene encodes a protein that interacts with the huntingtin-associated protein 1, which is a huntingtin binding protein that may function in vesicle trafficking.","<a href=""https://www.ncbi.nlm.nih.gov/gene/8997"">https://www.ncbi.nlm.nih.gov/gene/8997</a>"
NM_012281,3751,potassium voltage-gated channel subfamily D member 2,"Voltage-gated potassium (Kv) channels represent the most complex class of voltage-gated ion channels from both functional and structural standpoints. Their diverse functions include regulating neurotransmitter release, heart rate, insulin secretion, neuronal excitability, epithelial electrolyte transport, smooth muscle contraction, and cell volume. Four sequence-related potassium channel genes - shaker, shaw, shab, and shal - have been identified in Drosophila, and each has been shown to have human homolog(s). This gene encodes a member of the potassium channel, voltage-gated, shal-related subfamily, members of which form voltage-activated A-type potassium ion channels and are prominent in the repolarization phase of the action potential. This member mediates a rapidly inactivating, A-type outward potassium current which is not under the control of the N terminus as it is in Shaker channels.","<a href=""https://www.ncbi.nlm.nih.gov/gene/3751"">https://www.ncbi.nlm.nih.gov/gene/3751</a>"
NM_002241,3766,potassium voltage-gated channel subfamily J member 10,"This gene encodes a member of the inward rectifier-type potassium channel family, characterized by having a greater tendency to allow potassium to flow into, rather than out of, a cell. The encoded protein may form a heterodimer with another potassium channel protein and may be responsible for the potassium buffering action of glial cells in the brain. Mutations in this gene have been associated with seizure susceptibility of common idiopathic generalized epilepsy syndromes.","<a href=""https://www.ncbi.nlm.nih.gov/gene/3766"">https://www.ncbi.nlm.nih.gov/gene/3766</a>"
NM_001014797,3778,potassium calcium-activated channel subfamily M alpha 1,"MaxiK channels are large conductance, voltage and calcium-sensitive potassium channels which are fundamental to the control of smooth muscle tone and neuronal excitability. MaxiK channels can be formed by 2 subunits: the pore-forming alpha subunit, which is the product of this gene, and the modulatory beta subunit. Intracellular calcium regulates the physical association between the alpha and beta subunits. Alternatively spliced transcript variants encoding different isoforms have been identified.","<a href=""https://www.ncbi.nlm.nih.gov/gene/3778"">https://www.ncbi.nlm.nih.gov/gene/3778</a>"
NM_001032282,7071,Kruppel like factor 10,"This gene encodes a member of a family of proteins that feature C2H2-type zinc finger domains. The encoded protein is a transcriptional repressor that acts as an effector of transforming growth factor beta signaling. Activity of this protein may inhibit the growth of cancers, particularly pancreatic cancer. Alternative splicing results in multiple transcript variants.","<a href=""https://www.ncbi.nlm.nih.gov/gene/7071"">https://www.ncbi.nlm.nih.gov/gene/7071</a>"
NM_014079,28999,Kruppel like factor 15,,"<a href=""https://www.ncbi.nlm.nih.gov/gene/28999"">https://www.ncbi.nlm.nih.gov/gene/28999</a>"
NM_001206,687,Kruppel like factor 9,The protein encoded by this gene is a transcription factor that binds to GC box elements located in the promoter. Binding of the encoded protein to a single GC box inhibits mRNA expression while binding to tandemly repeated GC box elements activates transcription.,"<a href=""https://www.ncbi.nlm.nih.gov/gene/687"">https://www.ncbi.nlm.nih.gov/gene/687</a>"
NM_005561,3916,lysosomal associated membrane protein 1,The protein encoded by this gene is a member of a family of membrane glycoproteins.  This glycoprotein provides selectins with carbohydrate ligands.  It may also play a role in tumor cell metastasis.,"<a href=""https://www.ncbi.nlm.nih.gov/gene/3916"">https://www.ncbi.nlm.nih.gov/gene/3916</a>"
NM_052925,114823,leukocyte receptor cluster member 8,,"<a href=""https://www.ncbi.nlm.nih.gov/gene/114823"">https://www.ncbi.nlm.nih.gov/gene/114823</a>"
NM_001193482,3987,LIM zinc finger domain containing 1,"The protein encoded by this gene is an adaptor protein which contains five LIM domains, or double zinc fingers. The protein is likely involved in integrin signaling through its LIM domain-mediated interaction with integrin-linked kinase, found in focal adhesion plaques. It is also thought to act as a bridge linking integrin-linked kinase to NCK adaptor protein 2, which is involved in growth factor receptor kinase signaling pathways. Its localization to the periphery of spreading cells also suggests that this protein may play a role in integrin-mediated cell adhesion or spreading. Several transcript variants encoding different isoforms have been found for this gene.","<a href=""https://www.ncbi.nlm.nih.gov/gene/3987"">https://www.ncbi.nlm.nih.gov/gene/3987</a>"
NM_001001395,55885,LIM domain only 3,"The protein encoded by this gene belongs to the rhombotin family of cysteine-rich LIM domain oncogenes. This gene is predominantly expressed in the brain. Related family members, LMO1 and LMO2 on chromosome 11, have been reported to be involved in chromosomal translocations in T-cell leukemia. Many alternatively spliced transcript variants have been found for this gene.","<a href=""https://www.ncbi.nlm.nih.gov/gene/55885"">https://www.ncbi.nlm.nih.gov/gene/55885</a>"
NM_001289934,4034,leucine rich repeats and calponin homology domain containing 4,This gene encodes a protein that contains leucine-rich repeats (LRR) at its amino terminus and that is known to be involved in ligand binding. The carboxyl terminus may act as a membrane anchor. Identified structural elements suggest that the encoded protein resembles a receptor.,"<a href=""https://www.ncbi.nlm.nih.gov/gene/4034"">https://www.ncbi.nlm.nih.gov/gene/4034</a>"
NM_001199149,4057,lactotransferrin,"This gene is a member of the transferrin family of genes and its protein product is found in the secondary granules of neutrophils. The protein is a major iron-binding protein in milk and body secretions with an antimicrobial activity, making it an important component of the non-specific immune system. The protein demonstrates a broad spectrum of properties, including regulation of iron homeostasis, host defense against a broad range of microbial infections, anti-inflammatory activity, regulation of cellular growth and differentiation and protection against cancer development and metastasis. Antimicrobial, antiviral, antifungal and antiparasitic activity has been found for this protein and its peptides. Alternatively spliced transcript variants encoding different isoforms have been found for this gene.","<a href=""https://www.ncbi.nlm.nih.gov/gene/4057"">https://www.ncbi.nlm.nih.gov/gene/4057</a>"
